<?xml version="1.0" encoding="UTF-8"?>
<widget mode="window" height="0"  uid="http://tempuri.org" version="" width="0" xmlns="http://www.w3.org/ns/widgets" xmlns:xsi="http://www.w3.org/2001/XMLSchema-instance" xsi:schemaLocation="http://www.w3.org/ns/widgets w3cwidgets_v1p1.xsd ">
  <name>name</name>
  <description>description</description>
  <icon src="me">icon</icon>
  <icon src="me">icon</icon>
  <access network="false"/>
  <author email="" href="http://tempuri.org" img="">s</author>
  <licence>licence</licence>
  <content src="sdsd"></content>
  <update href="asa"></update>
  <feature name="jjj"></feature>
  <feature name="jjj"></feature>
  <feature name="jjj"></feature>
</widget>
